Company,Headline,Date,Source,Url
RMPL,Nishat takes over Rafhan,"Wed, 01 Jul 2026 07:16:13 +0500",Dawn - Business,https://www.dawn.com/news/2012100/nishat-takes-over-rafhan
PSX_MARKET,"Pakistan made 'meaningful' progress in fiscal federalism, but deviations remain: WB","Wed, 01 Jul 2026 18:44:11 +0500",Dawn - Business,https://www.dawn.com/news/2012199/pakistan-made-meaningful-progress-in-fiscal-federalism-but-deviations-remain-wb
PSX_MARKET,"PSX kicks off FY27 with positive momentum, gaining 3,700 points","Wed, 01 Jul 2026 20:28:57 +0500",Dawn - Business,https://www.dawn.com/news/2012187/psx-kicks-off-fy27-with-positive-momentum-gaining-3700-points
PSX_MARKET,World Bank approves $70m loan for Connected Punjab Programme aimed at improving digital infrastructure,"Wed, 01 Jul 2026 15:36:43 +0500",Dawn - Business,https://www.dawn.com/news/2012188/world-bank-approves-70m-loan-for-connected-punjab-programme-aimed-at-improving-digital-infrastructure
PSX_MARKET,"PSX rebounds to end FY26 above 180,000","Wed, 01 Jul 2026 07:14:07 +0500",Dawn - Business,https://www.dawn.com/news/2012096/psx-rebounds-to-end-fy26-above-180000
PSX_MARKET,Govt expects easing inflationary pressure in new fiscal year following reopening of Strait of Hormuz,"Tue, 30 Jun 2026 21:45:02 +0500",Dawn - Business,https://www.dawn.com/news/2011978/govt-expects-easing-inflationary-pressure-in-new-fiscal-year-following-reopening-of-strait-of-hormuz
PSX_MARKET,AJK Assembly passes Rs286bn budget for FY27,"Tue, 30 Jun 2026 07:24:13 +0500",Dawn - Business,https://www.dawn.com/news/2011813/ajk-assembly-passes-rs286bn-budget-for-fy27
PSX_MARKET,"Week after budget's passage, exporters urge govt to fulfil key demands; seek refund of Rs327bn","Tue, 30 Jun 2026 07:48:11 +0500",Dawn - Business,https://www.dawn.com/news/2011817/week-after-budgets-passage-exporters-urge-govt-to-fulfil-key-demands-seek-refund-of-rs327bn