Company,Headline,Date,Source,Url
PSX_MARKET,IMF-mandated curbs squeeze development spending,"Tue, 02 Jun 2026 07:46:41 +0500",Dawn - Business,https://www.dawn.com/news/2004543/imf-mandated-curbs-squeeze-development-spending
PSX_MARKET,Beverage industry proposes reduction in taxes from 20pc to 15pc ahead of FY2026-27 budget,"Tue, 02 Jun 2026 17:14:42 +0500",Dawn - Business,https://www.dawn.com/news/2004654/beverage-industry-proposes-reduction-in-taxes-from-20pc-to-15pc-ahead-of-fy2026-27-budget
PSX_MARKET,"Farmers look to budget with growing fears, fading hopes","Tue, 02 Jun 2026 07:48:55 +0500",Dawn - Business,https://www.dawn.com/news/2004546/farmers-look-to-budget-with-growing-fears-fading-hopes
PSX_MARKET,"PSX loses 3,362 points as geopolitical fears return","Tue, 02 Jun 2026 08:32:04 +0500",Dawn - Business,https://www.dawn.com/news/2004567/psx-loses-3362-points-as-geopolitical-fears-return
PSX_MARKET,"SBP launches riyal, dirham Naya Pakistan Certificates","Tue, 02 Jun 2026 09:34:04 +0500",Dawn - Business,https://www.dawn.com/news/2004569/sbp-launches-riyal-dirham-naya-pakistan-certificates
PSX_MARKET,Oil industry opposes windfall tax in upcoming budget,"Mon, 01 Jun 2026 07:01:27 +0500",Dawn - Business,https://www.dawn.com/news/2004210/oil-industry-opposes-windfall-tax-in-upcoming-budget
PSX_MARKET,Govt mulls scrapping export tax in budget,"Sat, 30 May 2026 07:42:43 +0500",Dawn - Business,https://www.dawn.com/news/2003828/govt-mulls-scrapping-export-tax-in-budget
PSX_MARKET,PSX extends gains in post-Eid session,"Sat, 30 May 2026 06:02:58 +0500",Dawn - Business,https://www.dawn.com/news/2003822/psx-extends-gains-in-post-eid-session
PSX_MARKET,"NA, Senate budget sessions summoned on June 5","Fri, 29 May 2026 12:14:16 +0500",Dawn - Business,https://www.dawn.com/news/2003641/na-senate-budget-sessions-summoned-on-june-5