Company,Headline,Date,Source,Url
MARI,Mari Energies gas sale to unlicensed entities sparks regulatory row,"Thu, 11 Jun 2026 07:51:03 +0500",Dawn - Business,https://www.dawn.com/news/2006821/mari-energies-gas-sale-to-unlicensed-entities-sparks-regulatory-row
PSX_MARKET,Govt unveils Rs18.8tr budget for FY2026-27; economic growth targeted at 4pc,"Fri, 12 Jun 2026 20:08:59 +0500",Dawn - Business,https://www.dawn.com/news/2007283/govt-unveils-rs188tr-budget-for-fy2026-27-economic-growth-targeted-at-4pc
PSX_MARKET,Provinces’ development freeze to persist beyond next fiscal year: Aurangzeb,"Fri, 12 Jun 2026 09:04:52 +0500",Dawn - Business,https://www.dawn.com/news/2007244/provinces-development-freeze-to-persist-beyond-next-fiscal-year-aurangzeb
PSX_MARKET,PSX outpaces peers despite late-year jitters,"Fri, 12 Jun 2026 05:18:23 +0500",Dawn - Business,https://www.dawn.com/news/2007196/psx-outpaces-peers-despite-late-year-jitters
PSX_MARKET,Income tax may fall for some salaried segments in upcoming budget,"Thu, 11 Jun 2026 07:19:14 +0500",Dawn - Business,https://www.dawn.com/news/2006813/income-tax-may-fall-for-some-salaried-segments-in-upcoming-budget
PSX_MARKET,Finance Minister Aurangzeb to present budget for FY2026-27 on June 12,"Wed, 10 Jun 2026 21:32:41 +0500",Dawn - Business,https://www.dawn.com/news/2006648/finance-minister-aurangzeb-to-present-budget-for-fy2026-27-on-june-12
PSX_MARKET,"Budget 2026-27: Centre, Punjab and Sindh agree on spending cuts","Wed, 10 Jun 2026 07:25:39 +0500",Dawn - Business,https://www.dawn.com/news/2006561/budget-2026-27-centre-punjab-and-sindh-agree-on-spending-cuts