Company,Headline,Date,Source,Url
PSX_MARKET,World Bank approves $375.9m to strengthen Pakistan's power transmission network,"Fri, 10 Jul 2026 11:54:24 +0500",Dawn - Business,https://www.dawn.com/news/2014357/world-bank-approves-3759m-to-strengthen-pakistans-power-transmission-network
PSX_MARKET,Duty-free imports rise to $27bn under tariff reform drive,"Fri, 10 Jul 2026 07:20:29 +0500",Dawn - Business,https://www.dawn.com/news/2014312/duty-free-imports-rise-to-27bn-under-tariff-reform-drive
PSX_MARKET,Mideast conflict to hit global economy: IMF,"Thu, 09 Jul 2026 07:27:07 +0500",Dawn - Business,https://www.dawn.com/news/2013990/mideast-conflict-to-hit-global-economy-imf
PSX_MARKET,"Tech, climate risks reshape banking: SBP chief","Thu, 09 Jul 2026 07:58:04 +0500",Dawn - Business,https://www.dawn.com/news/2013987/tech-climate-risks-reshape-banking-sbp-chief
PSX_MARKET,"PSX tumbles by over 4,600 points after Trump's comments on Iran","Wed, 08 Jul 2026 16:27:54 +0500",Dawn - Business,https://www.dawn.com/news/2013847/psx-tumbles-by-over-4600-points-after-trumps-comments-on-iran
PSX_MARKET,Stakeholders question Federal Committee on Agriculture’s cotton output estimates,"Wed, 08 Jul 2026 07:39:16 +0500",Dawn - Business,https://www.dawn.com/news/2013774/stakeholders-question-federal-committee-on-agricultures-cotton-output-estimates
PSX_MARKET,"PSX snaps 5-day bullish streak, falls by over 1,100 points","Tue, 07 Jul 2026 17:59:59 +0500",Dawn - Business,https://www.dawn.com/news/2013602/psx-snaps-5-day-bullish-streak-falls-by-over-1100-points
PSX_MARKET,Govt misses IMF deadline for notifying gas tariff,"Tue, 07 Jul 2026 07:37:28 +0500",Dawn - Business,https://www.dawn.com/news/2013535/govt-misses-imf-deadline-for-notifying-gas-tariff
PSX_MARKET,SBP launches portal to attract investment,"Tue, 07 Jul 2026 06:59:42 +0500",Dawn - Business,https://www.dawn.com/news/2013505/sbp-launches-portal-to-attract-investment