Company,Headline,Date,Source,Url
MARI,Mari Energies faces $19.1m International Chamber of Commerce claim,"Wed, 15 Jul 2026 08:01:38 +0500",Dawn - Business,https://www.dawn.com/news/2015521/mari-energies-faces-191m-international-chamber-of-commerce-claim
PSX_MARKET,"PSX continues recovery as KSE-100 index gains 2,600 points in early trade","Thu, 16 Jul 2026 11:23:46 +0500",Dawn - Business,https://www.dawn.com/news/2015872/psx-continues-recovery-as-kse-100-index-gains-2600-points-in-early-trade
PSX_MARKET,"Bulls snap losing streak as PSX gains over 1,700 points","Wed, 15 Jul 2026 17:05:11 +0500",Dawn - Business,https://www.dawn.com/news/2015614/bulls-snap-losing-streak-as-psx-gains-over-1700-points
PSX_MARKET,Senate panel irked by two-decade delay in transfer of Karachi's Hyatt Regency,"Wed, 15 Jul 2026 07:50:11 +0500",Dawn - Business,https://www.dawn.com/news/2015526/senate-panel-irked-by-two-decade-delay-in-transfer-of-karachis-hyatt-regency
PSX_MARKET,"Bloodbath at PSX as KSE-100 loses 6,400 points over renewed US-Iran fighting","Tue, 14 Jul 2026 17:56:01 +0500",Dawn - Business,https://www.dawn.com/news/2015331/bloodbath-at-psx-as-kse-100-loses-6400-points-over-renewed-us-iran-fighting
PSX_MARKET,GB unveils Rs20.48bn first quarter budget,"Tue, 14 Jul 2026 07:32:30 +0500",Dawn - Business,https://www.dawn.com/news/2015297/gb-unveils-rs2048bn-first-quarter-budget